{
  "schema_version": "1.0",
  "timestamp": "2026-10-06T14:20:00Z",
  "service": "payment-service",
  "trace_id": "4fd0b7f0a8d6404a",
  "cpu_pct": 62.1,
  "memory_pct": 71.4,
  "p95_latency_ms": 438.0,
  "error_rate": 0.032,
  "timeout_count": 14,
  "db_connections_pct": null,
  "queue_lag": null,
  "restart_count": 0,
  "log_error_count": 21
}
